<?xml version="1.0" encoding="UTF-8"?>
<xs:schema
    xmlns:xs="http://www.w3.org/2001/XMLSchema" elementFormDefault="qualified">
    <xs:element name="announcements">
        <xs:complexType>
            <xs:sequence>
                <xs:element maxOccurs="unbounded" ref="row"/>
            </xs:sequence>
        </xs:complexType>
    </xs:element>
    <xs:element name="row">
        <xs:complexType>
            <xs:sequence>
                <xs:element ref="announcement_id"/>
                <xs:element ref="announcement_title"/>
                <xs:element ref="announcement_message"/>
                <xs:element ref="event_id"/>
            </xs:sequence>
        </xs:complexType>
    </xs:element>
	<xs:element name="announcement_id">
        <xs:simpleType>
            <xs:restriction base="xs:integer">
                <xs:minInclusive value="1"/>
            </xs:restriction>
        </xs:simpleType>
    </xs:element>
    <xs:element name="announcement_title" type="xs:string"/>
	<xs:element name="announcement_message">
        <xs:simpleType>
            <xs:restriction base="xs:string">
                <xs:whiteSpace value="preserve"/>
            </xs:restriction>
        </xs:simpleType>
    </xs:element>
	<xs:element name="event_id">
        <xs:simpleType>
            <xs:restriction base="xs:integer">
                <xs:minInclusive value="1"/>
            </xs:restriction>
        </xs:simpleType>
    </xs:element>
</xs:schema>